commit	val_bpb	memory_gb	status	description
eec0b91	1.923455	5.9	keep	baseline (depth=4 device_batch=8 eval_batch=32)
be83fff	1.724442	5.8	keep	Muon optimizer for 2D hidden layer params (Newton-Schulz orthogonalization)
bc81e67	1.671829	5.8	keep	halve total batch size to 2^15 (more steps 379 vs 198)
86a3e94	1.658866	5.9	keep	PoPE (Polar Positional Embedding) replacing RoPE
b519033	1.642328	5.8	keep	reduce total batch size to 2^14 (756 steps)
fc4ecc8	1.633649	5.8	keep	add 5% warmup ratio
30cc6e7	1.629301	5.6	keep	SwiGLU activation replacing squared ReLU in MLP
9bf2cf7	1.429509	5.6	keep	NorMuon (neuron-wise normalized Muon) - massive improvement
